{
  "schema_version": "1.0.0",
  "observed_at": "2026-09-12T00:00:00Z",
  "max_age_seconds": 300,
  "platform": "linux",
  "capabilities": [
    "evidence.report"
  ],
  "connectors": [],
  "credentials": [],
  "resources": [],
  "models": [],
  "configured_jobs": [],
  "grants": [],
  "budget": {
    "amount": 0,
    "currency": "USD"
  },
  "blocked": false
}
